{
  "schemaVersion": "catverter.pack-index/v1",
  "id": "catverter.contributions",
  "displayName": "Catverter Contributions",
  "version": "1.0.41",
  "author": "Catverter",
  "description": "Validated community packs for Catverter.",
  "packs": [
    {
      "id": "catverter.gioztrex.livorno.pack",
      "kind": "units",
      "displayName": "Livorno Pack",
      "version": "1.0.41",
      "author": "GiozTrex",
      "description": "Unità in livornese.",
      "downloadUrl": "gioztrex/livorno.json",
      "languages": ["it-IT"],
      "dependencies": [
        { "id": "catverter.core.mass", "minVersion": "1.0.0" }
      ],
      "contentRating": "general",
      "badges": ["committeePick", "packOfTheMonth"],
      "featuredOrder": 2,
      "featuredReason": {
        "en": "Approved after careful sample-based science.",
        "it": "Approvato dopo attenta scienza a campione."
      }
    },
    { "id": "catverter.gioztrex.test-pack-01", "kind": "units", "displayName": "Ceremonial Spoon Pack", "version": "1.0.41", "author": "gioztrex", "description": "Adds the ceremonial spoon mass unit.", "downloadUrl": "gioztrex/gioztrex-test-pack-01.json", "languages": ["en"], "dependencies": [{ "id": "catverter.core.mass", "minVersion": "1.0.0" }], "contentRating": "general" },
    { "id": "catverter.gioztrex.test-pack-02", "kind": "units", "displayName": "Pocket Thunder Pack", "version": "1.0.41", "author": "gioztrex", "description": "Adds the pocket thunder mass unit.", "downloadUrl": "gioztrex/gioztrex-test-pack-02.json", "languages": ["en"], "dependencies": [{ "id": "catverter.core.mass", "minVersion": "1.0.0" }], "contentRating": "general" },
    { "id": "catverter.gioztrex.test-pack-03", "kind": "units", "displayName": "Office Biscuit Pack", "version": "1.0.41", "author": "gioztrex", "description": "Adds the office biscuit mass unit.", "downloadUrl": "gioztrex/gioztrex-test-pack-03.json", "languages": ["en"], "dependencies": [{ "id": "catverter.core.mass", "minVersion": "1.0.0" }], "contentRating": "general" },
    { "id": "catverter.gioztrex.test-pack-04", "kind": "units", "displayName": "Suspicious Meatball Pack", "version": "1.0.41", "author": "gioztrex", "description": "Adds the suspicious meatball mass unit.", "downloadUrl": "gioztrex/gioztrex-test-pack-04.json", "languages": ["en"], "dependencies": [{ "id": "catverter.core.mass", "minVersion": "1.0.0" }], "contentRating": "general" },
    { "id": "catverter.gioztrex.test-pack-05", "kind": "units", "displayName": "Heroic Lasagna Square Pack", "version": "1.0.41", "author": "gioztrex", "description": "Adds the heroic lasagna square mass unit.", "downloadUrl": "gioztrex/gioztrex-test-pack-05.json", "languages": ["en"], "dependencies": [{ "id": "catverter.core.mass", "minVersion": "1.0.0" }], "contentRating": "general" },
    { "id": "catverter.gioztrex.test-pack-06", "kind": "units", "displayName": "Tiny Anvil Pack", "version": "1.0.41", "author": "gioztrex", "description": "Adds the tiny anvil mass unit.", "downloadUrl": "gioztrex/gioztrex-test-pack-06.json", "languages": ["en"], "dependencies": [{ "id": "catverter.core.mass", "minVersion": "1.0.0" }], "contentRating": "general" },
    { "id": "catverter.gioztrex.test-pack-07", "kind": "units", "displayName": "Municipal Croissant Pack", "version": "1.0.41", "author": "gioztrex", "description": "Adds the municipal croissant mass unit.", "downloadUrl": "gioztrex/gioztrex-test-pack-07.json", "languages": ["en"], "dependencies": [{ "id": "catverter.core.mass", "minVersion": "1.0.0" }], "contentRating": "general" },
    { "id": "catverter.gioztrex.test-pack-08", "kind": "units", "displayName": "Bath Towel of Destiny Pack", "version": "1.0.41", "author": "gioztrex", "description": "Adds the bath towel of destiny mass unit.", "downloadUrl": "gioztrex/gioztrex-test-pack-08.json", "languages": ["en"], "dependencies": [{ "id": "catverter.core.mass", "minVersion": "1.0.0" }], "contentRating": "general" },
    { "id": "catverter.gioztrex.test-pack-09", "kind": "units", "displayName": "Dramatic Pumpkin Seed Pack", "version": "1.0.41", "author": "gioztrex", "description": "Adds the dramatic pumpkin seed mass unit.", "downloadUrl": "gioztrex/gioztrex-test-pack-09.json", "languages": ["en"], "dependencies": [{ "id": "catverter.core.mass", "minVersion": "1.0.0" }], "contentRating": "general" },
    { "id": "catverter.gioztrex.test-pack-10", "kind": "units", "displayName": "Emergency Espresso Cup Pack", "version": "1.0.41", "author": "gioztrex", "description": "Adds the emergency espresso cup mass unit.", "downloadUrl": "gioztrex/gioztrex-test-pack-10.json", "languages": ["en"], "dependencies": [{ "id": "catverter.core.mass", "minVersion": "1.0.0" }], "contentRating": "general" },
    { "id": "catverter.gioztrex.test-pack-11", "kind": "units", "displayName": "Sleepy Keyboard Pack", "version": "1.0.41", "author": "gioztrex", "description": "Adds the sleepy keyboard mass unit.", "downloadUrl": "gioztrex/gioztrex-test-pack-11.json", "languages": ["en"], "dependencies": [{ "id": "catverter.core.mass", "minVersion": "1.0.0" }], "contentRating": "general" },
    { "id": "catverter.gioztrex.test-pack-12", "kind": "units", "displayName": "Ceremonial Remote Pack", "version": "1.0.41", "author": "gioztrex", "description": "Adds the ceremonial remote control mass unit.", "downloadUrl": "gioztrex/gioztrex-test-pack-12.json", "languages": ["en"], "dependencies": [{ "id": "catverter.core.mass", "minVersion": "1.0.0" }], "contentRating": "general" },
    { "id": "catverter.gioztrex.test-pack-13", "kind": "units", "displayName": "Portable Cloud Fragment Pack", "version": "1.0.41", "author": "gioztrex", "description": "Adds the portable cloud fragment mass unit.", "downloadUrl": "gioztrex/gioztrex-test-pack-13.json", "languages": ["en"], "dependencies": [{ "id": "catverter.core.mass", "minVersion": "1.0.0" }], "contentRating": "general" },
    { "id": "catverter.gioztrex.test-pack-14", "kind": "units", "displayName": "Academic Pineapple Pack", "version": "1.0.41", "author": "gioztrex", "description": "Adds the academic pineapple mass unit.", "downloadUrl": "gioztrex/gioztrex-test-pack-14.json", "languages": ["en"], "dependencies": [{ "id": "catverter.core.mass", "minVersion": "1.0.0" }], "contentRating": "general" },
    { "id": "catverter.gioztrex.test-pack-15", "kind": "units", "displayName": "Sofa Crumb Pack", "version": "1.0.41", "author": "gioztrex", "description": "Adds the sofa crumb mass unit.", "downloadUrl": "gioztrex/gioztrex-test-pack-15.json", "languages": ["en"], "dependencies": [{ "id": "catverter.core.mass", "minVersion": "1.0.0" }], "contentRating": "general" },
    { "id": "catverter.gioztrex.test-pack-16", "kind": "units", "displayName": "Legendary Sock Pack", "version": "1.0.41", "author": "gioztrex", "description": "Adds the legendary sock mass unit.", "downloadUrl": "gioztrex/gioztrex-test-pack-16.json", "languages": ["en"], "dependencies": [{ "id": "catverter.core.mass", "minVersion": "1.0.0" }], "contentRating": "general" },
    { "id": "catverter.gioztrex.test-pack-17", "kind": "units", "displayName": "Calibrated Pillow Pack", "version": "1.0.41", "author": "gioztrex", "description": "Adds the calibrated pillow mass unit.", "downloadUrl": "gioztrex/gioztrex-test-pack-17.json", "languages": ["en"], "dependencies": [{ "id": "catverter.core.mass", "minVersion": "1.0.0" }], "contentRating": "general" },
    { "id": "catverter.gioztrex.test-pack-18", "kind": "units", "displayName": "Tiny Dumbbell of Regret Pack", "version": "1.0.41", "author": "gioztrex", "description": "Adds the tiny dumbbell of regret mass unit.", "downloadUrl": "gioztrex/gioztrex-test-pack-18.json", "languages": ["en"], "dependencies": [{ "id": "catverter.core.mass", "minVersion": "1.0.0" }], "contentRating": "general" },
    { "id": "catverter.gioztrex.test-pack-19", "kind": "units", "displayName": "Serious Sandwich Pack", "version": "1.0.41", "author": "gioztrex", "description": "Adds the serious sandwich mass unit.", "downloadUrl": "gioztrex/gioztrex-test-pack-19.json", "languages": ["en"], "dependencies": [{ "id": "catverter.core.mass", "minVersion": "1.0.0" }], "contentRating": "general" },
    { "id": "catverter.gioztrex.test-pack-20", "kind": "units", "displayName": "Parliament Banana Pack", "version": "1.0.41", "author": "gioztrex", "description": "Adds the parliament banana mass unit.", "downloadUrl": "gioztrex/gioztrex-test-pack-20.json", "languages": ["en"], "dependencies": [{ "id": "catverter.core.mass", "minVersion": "1.0.0" }], "contentRating": "general" },
    { "id": "catverter.gioztrex.test-pack-21", "kind": "units", "displayName": "Confused Teacup Pack", "version": "1.0.41", "author": "gioztrex", "description": "Adds the confused teacup mass unit.", "downloadUrl": "gioztrex/gioztrex-test-pack-21.json", "languages": ["en"], "dependencies": [{ "id": "catverter.core.mass", "minVersion": "1.0.0" }], "contentRating": "general" },
    { "id": "catverter.gioztrex.test-pack-22", "kind": "units", "displayName": "Victory Muffin Pack", "version": "1.0.41", "author": "gioztrex", "description": "Adds the victory muffin mass unit.", "downloadUrl": "gioztrex/gioztrex-test-pack-22.json", "languages": ["en"], "dependencies": [{ "id": "catverter.core.mass", "minVersion": "1.0.0" }], "contentRating": "general" },
    { "id": "catverter.gioztrex.test-pack-23", "kind": "units", "displayName": "Bureaucracy Stapler Pack", "version": "1.0.41", "author": "gioztrex", "description": "Adds the bureaucracy stapler mass unit.", "downloadUrl": "gioztrex/gioztrex-test-pack-23.json", "languages": ["en"], "dependencies": [{ "id": "catverter.core.mass", "minVersion": "1.0.0" }], "contentRating": "general" },